{
  "uuid": "a1b2c3d4-e5f6-7890-abcd-ef1234567890",
  "session_uuid": "a1b2c3d4-e5f6-7890-abcd-ef1234567890",
  "timestamp": "2025-03-15T14:30:00Z",
  "category": "credentials_failed",
  "type": "duo_native_failed",
  "country": "example-value",
  "target_user": "example-value",
  "client": "example-value"
}